{
  "schema_version": "1.0.0",
  "metric_id": "automation.controls_total",
  "label": "Total Controls",
  "recorded_at": "2026-04-18T13:00:00Z",
  "value": 87,
  "unit": "controls",
  "aggregation": "count",
  "dimensions": {
    "framework": "fedramp-moderate",
    "provider": "aws"
  },
  "source": "grc-engineer://record-automation-metrics",
  "subject": {
    "kind": "framework",
    "id": "fedramp-moderate"
  }
}
