{
  "schema_version": "1.0.0",
  "metric_id": "findings.open_critical",
  "label": "Open Critical Findings",
  "recorded_at": "2026-04-18T13:05:00Z",
  "value": 3,
  "unit": "count",
  "aggregation": "count",
  "dimensions": {
    "business_unit": "platform",
    "source": "gap-assessment"
  },
  "source": "grc-engineer://gap-assessment",
  "subject": {
    "kind": "program",
    "id": "platform-security"
  }
}
